id,type,text,question,option1,option2,option3,option4,correct
1,text,"Het is december. Paulo krijgt van de gemeente een folder met informatie over het afsteken van vuurwerk.

Wanneer mag u vuurwerk afsteken?
U mag vuurwerk afsteken tussen 31 december 18.00 uur en 1 januari 02.00 uur. U kunt een boete van € 100 krijgen als u vuurwerk afsteekt buiten deze tijden.

Vuurwerkverbod op bepaalde plekken
In onze gemeente is op sommige plekken het afsteken van vuurwerk verboden: in het winkelcentrum, in de buurt van het Maxima-ziekenhuis en bij alle kinderboerderijen.

Veilig vuurwerk afsteken
Gaat u tijdens de jaarwisseling vuurwerk afsteken of buiten naar het vuurwerk kijken? Dan kunt u het beste uw ogen beschermen met een vuurwerkbril.","Paulo wil vuurwerk afsteken met oud & nieuw. Wanneer mag dat precies?","Alleen op 31 december de hele dag.","Alleen op 1 januari de hele dag.","Van 31 december om 18 uur 's avonds tot 1 januari om 2 uur 's nachts.","Op 31 december & op 1 januari de hele dag.",2
2,text,"Het is december. Paulo krijgt van de gemeente een folder met informatie over het afsteken van vuurwerk.

Vuurwerkverbod op bepaalde plekken
In onze gemeente is op sommige plekken het afsteken van vuurwerk verboden: in het winkelcentrum, in de buurt van het Maxima-ziekenhuis en bij alle kinderboerderijen.","Paulo wil vuurwerk afsteken. Waar mag hij dat doen?","Dichtbij het ziekenhuis.","In het winkelcentrum.","Niet bij het ziekenhuis en ook niet in het winkelcentrum.",,2
3,text,"Veilig vuurwerk afsteken
Gaat u tijdens de jaarwisseling vuurwerk afsteken of buiten naar het vuurwerk kijken? Dan kunt u het beste uw ogen beschermen met een vuurwerkbril.","Paolo koopt een vuurwerkbril. Waarom koopt hij die speciale bril?","Die bril beschermt zijn ogen.","Met die bril kan hij het vuurwerk beter zien.","De vuurwerkbril is verplicht.",,0
4,text,"Nanda krijgt een e-mail van haar broer Adriaan en zijn vriend Olivier. Zij schrijven haar over het plan voor het weekend.

Hoi Nanda
Hoe gaat het met je? Met ons is alles goed. Het is druk in onze kaaswinkel en ook bij ons thuis. Dit weekend hebben we een afspraak met je. We hadden afgesproken, dat we zaterdagochtend om 10 uur bij jou zijn. We gaan je trakteren op een dagje uit. We komen, maar we moeten in de ochtend nog werken in onze winkel. Dus 10 uur redden we niet. Het wordt iets later, we denken half 12. We sturen je een foto mee van het bootje, dat we gehuurd hebben. Daarmee gaan we zaterdagmiddag samen het water op. Leuk, toch?
Wij slapen van zaterdag op zondag in een Bed & Breakfast, dichtbij jouw huis.

Op zondagochtend gaan we zoals afgesproken samen met jou om 10 uur naar de kerk. We hebben er zin in!

Groetjes en tot zaterdag, Adriaan & Olivier","Nanda krijgt bezoek. Wanneer komen Adriaan en Olivier aan?","Op zaterdagochtend om 10 uur.","Op zaterdagochtend om half 12.","Op zondagochtend om 10 uur.","Zaterdagmiddag.",1
5,text,"Hoi Nanda
Hoe gaat het met je? Met ons is alles goed. Het is druk in onze kaaswinkel en ook bij ons thuis. Dit weekend hebben we een afspraak met je. We hadden afgesproken, dat we zaterdagochtend om 10 uur bij jou zijn. We gaan je trakteren op een dagje uit. We komen, maar we moeten in de ochtend nog werken in onze winkel. Dus 10 uur redden we niet.","Moeten Adriaan en Olivier op zaterdag werken?","Ja, zij moeten eerst werken op hun boot.","Ja, zij moeten eerst werken in hun winkel.","Ja, zij hebben een Bed & Breakfast-bedrijf.","Nee, zij staan vroeg op en gaan extra vroeg naar Nanda.",1
6,text,"Fatima heeft schade aan haar nieuwe auto. Zij wil de kosten van de schade vergoed krijgen van de verzekeringsmaatschappij. Zij krijgt deze e-mail.

Geachte heer, mevrouw,

Wij hebben uw vraag over schadevergoeding ontvangen. U heeft schade aan uw nieuwe auto. U wilt dat wij deze schade vergoeden. U hebt ons alle informatie gestuurd over de schade.

Op basis van de informatie die u ons heeft gegeven, kunnen we u het volgende meedelen: u hebt recht op een schadevergoeding, maar u hebt ook een eigen risico van € 250. U moet, zoals ook in de polis staat, uw auto laten repareren bij uw eigen Toyota-garage.

Wij wensen u na deze reparatie weer veel schadevrije kilometers!

Met vriendelijke groet,
ARAG Autoverzekeringen","Hoeveel schadevergoeding krijgt Fatima?","De schade aan de nieuwe auto wordt 100% vergoed.","Zij zal € 250 euro schadevergoeding krijgen van de verzekering.","Zij krijgt een vergoeding, maar zij moet € 250 zelf betalen.","De garage weet hoeveel schadevergoeding Fatima zal krijgen.",2
7,text,"U moet, zoals ook in de polis staat, uw auto laten repareren bij uw eigen Toyota-garage.","Wie gaat de auto repareren?","Fatima heeft de auto zelf gerepareerd.","De ARAG repareert de auto van Fatima.","De Toyota-garage gaat de auto van Fatima repareren.",,2
8,text,"Maxima ziet een folder met reclame voor een abonnement op een tijdschrift.

Storyplus –magazine – speciaal voor u!

Storyplus –magazine is al tientallen jaren het belangrijkste tijdschrift voor iedereen die alles wil weten van de Nederlandse televisiesterren en de leden van het koninklijk huis. En zegt u nu zelf: wie wil dat niet?

Storyplus –magazine verschijnt wekelijks. Wij hebben voor u een speciaal aanbod: U betaalt niet € 82,95, maar slechts € 49,75 voor een jaarabonnement. Dat is een korting van 40%. U betaalt minder dan 1 euro per week!

Wilt u straks ook alles weten over onze koning, over onze koningin en over hun kinderen? Wilt u het laatste nieuws weten over alle bekende Nederlanders die u elke dag op de televisie ziet? Dat kan!

Laat deze unieke kans niet lopen: bel uiterlijk vóór 31 december naar 0900 – 244.62 44 of vul (vóór 31 december) het formulier in op www.storyplus.nl

Storyplus –magazine … Lees ons elke week en u weet echt alles!!!","Wat voor soort tijdschrift is Storyplus –magazine?","Een dagblad.","Een maandblad.","Een weekblad.",,2
9,text,"Storyplus –magazine is al tientallen jaren het belangrijkste tijdschrift voor iedereen die alles wil weten van de Nederlandse televisiesterren en de leden van het koninklijk huis.

Wilt u straks ook alles weten over onze koning, over onze koningin en over hun kinderen? Wilt u het laatste nieuws weten over alle bekende Nederlanders die u elke dag op de televisie ziet?","Wat voor nieuws kan Maxima lezen in Storyplus –magazine?","Nieuws over het koninklijk huis.","Nieuws over belangrijke politieke zaken.","Nieuws over kleding die je met 40% korting kunt kopen.",,0
10,text,"Laat deze unieke kans niet lopen: bel uiterlijk vóór 31 december naar 0900 – 244.62 44 of vul (vóór 31 december) het formulier in op www.storyplus.nl","Maxima wil een jaarabonnement nemen op Storyplus –magazine. Hoe kan zij gebruik maken van deze aanbieding van 40% korting?","Zij moet deze week € 49,75 betalen aan Storyplus –magazine.","Zij moet deze maand € 49,75 betalen aan Storyplus –magazine.","Zij moet vóór 31 december bellen of een formulier invullen.",,2
11,text,"Monica leest in de krant een bericht over vergrijzing.

De mensen in Nederland worden ouder en ouder.

Vergrijzing
Er komen steeds meer oude mensen in Nederland. In 2018 waren er 2.9 miljoen 65-plussers. In 2040 zullen dat er 4,7 miljoen zijn. Tot 2060 blijft dat aantal ongeveer hetzelfde. Vanaf 2025 komen er snel meer 80-plussers.

In 2040 is ongeveer 26 procent van de bevolking 65-plusser. Bijna 10% van de Nederlanders is in 2040 ouder dan 80 jaar. In 2012 waren er 686.227 mensen van 80 jaar of ouder, in 2040 zijn dat er 1.554.742.","Hoeveel 80-plussers zullen er in 2040 in Nederland wonen?","2.900.000.","4.700.000.","1.554.742.",,2
12,text,"In 2040 is ongeveer 26 procent van de bevolking 65-plusser. Bijna 10% van de Nederlanders is in 2040 ouder dan 80 jaar.","Hoeveel procent van de Nederlandse bevolking is in 2040 ouder dan 65 jaar?","26%.","10%.","Minder dan 10%.","Veel meer dan 26%.",0
13,text,"In 2040 zullen dat er 4,7 miljoen zijn. Tot 2060 blijft dat aantal ongeveer hetzelfde.","Hoeveel 65-plussers zijn er in 2060 ongeveer in Nederland?","Hierover staat niets in deze tekst.","Ongeveer 4,7 miljoen.","Ongeveer 2,9 miljoen.","Ongeveer 1,5 miljoen.",1
14,text,"Clara schrijft deze e-mail aan haar baas, Karel de Schone.

Aan: karel@deschone.nl
CC:
Onderwerp: stoppen met werken bij De Schone B.V.

Beste Karel de Schone,

Ik schrijf u deze mail om u te vertellen dat ik stop met het werk bij het bedrijf De Schone B.V.

Ik heb twee jaar lang bij u gewerkt, maar u wilt mij geen vast contract geven. Ook vind ik het salaris onvoldoende. Daarom ga ik weg.

Ik heb met plezier het werk gedaan en ik heb fijne collega's gehad, maar ik kan bij een andere werkgever een beter contract krijgen.

Ik wil per direct stoppen. Ik kom dus morgen ook niet werken.

Mijn collega's Maria en Carolien kunnen deze week mijn werk overnemen. Zij weten, dat ik stop bij uw bedrijf en zij weten dat ik deze mail aan u schrijf.

Met vriendelijke groet,
Clara Marks.","Waarom stopt Clara met werken bij De Schone B.V.?","Zij is ontevreden over haar salaris en over haar contract.","Zij vindt dat werk niet leuk.","Zij heeft ruzie met haar collega's Maria en Carolien.",,0
15,text,"Ik wil per direct stoppen. Ik kom dus morgen ook niet werken.","Wanneer stopt Clara precies met het werk bij De Schone B.V.?","Over twee jaar.","Overmorgen.","Over een week.","Vandaag.",3
16,text,"Ivan zoekt informatie over werken in de zorgsector. Hij leest dit op een website.

Werken in de zorg.

In Nederland hebben in 2019 ruim 1 miljoen mensen betaald werk in de zorg. Ruim een derde van hen (36%) werkt in de verpleging, verzorging en thuiszorg (VVT), een kwart (27%) werkt in een ziekenhuis. Tussen 2013 en 2019 hebben steeds minder mensen een betaalde baan in de zorg gevonden.

Wel zijn er veel meer vrijwilligers in de zorg gaan werken. Dat heet mantelzorg: zieke en oude mensen worden verzorgd door hun familie of door een bekende.

Het aantal mantelzorgers is tussen de drie en vier miljoen.

Branche percentage werknemers aantal werknemers
Verpleging, verzorging en thuiszorg (VVT) 36% 370.000
Ziekenhuizen 27% 280.000
Gehandicaptenzorg 15% 160.000
(Bron: CBS en UWV)","Ivan leest dat veel Nederlanders actief zijn in de zorgsector. Hoeveel Nederlanders hebben een betaalde baan in de zorg?","Meer dan 1 miljoen.","370.000","Tussen de drie en vier miljoen.","280.000",0
17,text,"Wel zijn er veel meer vrijwilligers in de zorg gaan werken. Dat heet mantelzorg: zieke en oude mensen worden verzorgd door hun familie of door een bekende.","Wat is een mantelzorger volgens deze tekst?","Iemand die werkt met gehandicapten.","Iemand die werkt in een ziekenhuis.","Iemand die vrijwilligerswerk doet.",,2
18,text,"Manou is 18 weken zwanger. Zij krijgt een folder van haar huisarts.

'Fit voor de bevalling'

Je krijgt binnenkort een kindje. Spannend!

Geef je nu op voor de zwangerschapscursus 'Fit voor de bevalling'. Tijdens de cursus die begint op 1 maart, krijg je veel informatie over de zwangerschap en je doet ook wekelijks yoga-oefeningen in Het Buurtcentrum in Kollum.

Deze oefeningen zijn belangrijk als na 9 maanden de baby komt! Met speciale ademhaling kun je in deze periode tot en met de geboorte van je kindje fit blijven. Je komt naar de cursus samen met andere aanstaande moeders.

Lesinformatie
De cursus bestaat uit 7 lessen à 90 minuten en vindt plaats in kleine groepen (maximaal 10 deelnemers).

Kosten Zwangerschapsyoga: € 85
Tijdstip: Maandagavond 19.15 uur. Start: 1 maart.
Plaats: Buurtcentrum, Hoofdstraat 1, Kollum","Manou wil graag fit blijven in de periode van de zwangerschap. Wat gaat zij doen?","Zij gaat 7 weken lang meedoen aan een cursus zwangerschapsyoga.","Zij gaat 9 maanden lang meedoen aan de cursus zwangerschapsyoga.","Zij gaat 18 weken lang meedoen aan de cursus zwangerschapsyoga.",,0
19,text,"Tijdens de cursus die begint op 1 maart, krijg je veel informatie over de zwangerschap en je doet ook wekelijks yoga-oefeningen in Het Buurtcentrum in Kollum.","Manou wil meedoen aan deze cursus. Wat krijgt zij tijdens de cursus?","Een kindje.","Betere ademhaling.","Zij krijgt veel informatie en zij gaat veel yoga-oefeningen doen.",,2
20,text,"De cursus bestaat uit 7 lessen à 90 minuten en vindt plaats in kleine groepen (maximaal 10 deelnemers).","Hoe lang duurt één les?","1 uur.","1,5 uur.","Dat staat niet in deze tekst.",,1
21,text,"Ahmed huurt een woning in de Roordaflat in de Boerhaavewijk. Hij leest dit bericht in de wijkkrant over zijn flat.

FEESTJE NA RENOVATIE ROORDASTRAAT BOERHAAVEWIJK

In de Roordastraat was het feest op donderdagmiddag 18 mei 2019. Bewoners van de Roordastraat vierden samen met hun woningbouwvereniging Elan Wonen de renovatie van de flat in hun straat.

Dit zei de wethouder van de gemeente: 'Er is én er wordt hard gewerkt in de Boerhaavewijk. De Roordastraat ziet er weer modern uit en de 40 woningen zijn nu heel goed verbeterd.'

De entree en de balkons zijn gemoderniseerd. Ook de liften in het gebouw zijn vernieuwd. Tenslotte zijn alle kozijnen en buitendeuren gerenoveerd.

De renovatie heeft ongeveer 18 maanden geduurd, van januari 2018 tot augustus 2019.

De huurprijzen veranderen in 2019 voor de bewoners niet. De huurprijzen in de Roordastraat zijn gelijk gebleven.

Kijk voor meer informatie op www.elanwonen.nl.","In welke periode zijn de woningen gerenoveerd?","In de periode 2018-2019.","Op 18 mei 2019.","In het jaar 2019.","In het jaar 2018.",0
22,text,"De entree en de balkons zijn gemoderniseerd. Ook de liften in het gebouw zijn vernieuwd. Tenslotte zijn alle kozijnen en buitendeuren gerenoveerd.

De huurprijzen veranderen in 2019 voor de bewoners niet. De huurprijzen in de Roordastraat zijn gelijk gebleven.","Wat is niet veranderd bij de renovatie van de Roordastraat?","De liften.","De kozijnen en de buitendeuren.","De huurprijs.",,2
23,text,"Bewoners van de Roordastraat vierden samen met hun woningbouwvereniging Elan Wonen de renovatie van de flat in hun straat.","Wie is de eigenaar van de woning van Ahmed in de Roordastraat?","Ahmed.","De wethouder van de gemeente.","De vereniging Elan Wonen.",,2
24,text,"Ineke komt op zondagavond thuis van vakantie. Zij ziet een e-mail van haar collega Marleen.

Hoi Ineke

Het is nu zondagavond en ik stuur je even een e-mailtje.
Hoe was je vakantie? Ik hoop dat je goed uitgerust bent …

Welkom terug en succes morgen! Er is veel te doen …

Je kunt morgenochtend in de agenda zien wat er gebeurd is in jouw vakantie.

Ga je met mij mee naar de HEMA morgen of op dinsdag? We kopen daar dan spullen voor het afscheidsfeest van Ad. Dat feest is over twee weken, op 2 september. Ook moeten we weten wie er komt op die dag. Misschien komen er op die dag wel 100 mensen, dus we moeten veel organiseren!

Op donderdag kom ik weer werken.

Als je dus morgen of overmorgen met mij naar de HEMA wil, stuur me dan even een bericht of bel me!

Goede start morgen en groetjes
Marleen","Wat wil Marleen graag met Ineke afspreken?","Zij wil graag met Ineke naar de HEMA.","Zij wil graag met Ineke naar Ad.","Zij wil graag met Ineke op vakantie.","Zij wil graag met Ineke naar een feest.",0
25,text,"Op donderdag kom ik weer werken.","Wanneer gaat Marleen weer naar haar werk?","Op 2 september.","Op maandag.","Op dinsdag.","Op donderdag.",3